source_id,source_class,title,edition_date,scope,url,limitations
SKETCHFAB_POLONEZ_MR93,asset_source,1993 FSO Polonez Caro MR'93 (LP new),2023-07-15,"Visual model identity, author, publication metadata and displayed license label",https://sketchfab.com/3d-models/1993-fso-polonez-caro-mr93-lp-new-f67c26c7db354b10b203c7e2f157467d,"The page displays Sketchfab Free Standard rather than a Creative Commons license; do not treat the raw GLB as redistribution-cleared."
SKETCHFAB_LICENSE,license_terms_primary,Sketchfab License Agreement,2026-07-14,"Restrictions on standalone or extractable redistribution of material licensed under Sketchfab standard terms",https://sketchfab.com/licenses,"Terms may change and purchase-specific rights can differ; this inventory is a project risk note rather than legal advice."
WIKIPEDIA_POLONEZ_EN,secondary_encyclopedic,FSO Polonez,2026-07-14,"MR'93 chronology, engine families, outputs and production-year cross-check",https://en.wikipedia.org/wiki/FSO_Polonez,"Secondary compilation; replace engine dates, outputs and transmission applications with FSO manuals, homologation data or period brochures before final runtime calibration."
WIKIPEDIA_POLONEZ_ES,secondary_encyclopedic,FSO Polonez,2026-07-14,"Independent language-edition cross-check for the 1993–1997 Caro MR'93 generation boundary",https://es.wikipedia.org/wiki/FSO_Polonez,"Secondary cross-check only; does not resolve application-specific gearbox ratios."
WIKIPEDIA_PSA_XUD,secondary_technical_family,PSA XUD engine,2026-07-14,"XUD9A displacement, naturally aspirated indirect-injection architecture and Polonez application",https://en.wikipedia.org/wiki/PSA_XUD_engine,"Engine-family source rather than an FSO application sheet; final powertrain values need an FSO-specific primary source."
RECON_MR93,reconstruction,Polonez Caro MR'93 powertrain reconstruction,2026-07-14,"Wide-track MR'93 overlap windows and conservative six-candidate catalog boundary",,"Research seed only. Exact gearbox codes, forward and reverse ratios, final drives, masses, tire sizes and month-level transitions remain unresolved."
